{"name":"Verify Get All Books","id":"book-store-page-api;verify-get-all-books","scenarioId":"api/bookStorePageApi:Verify Get All Books","methodName":"Verify Get All Books","testSteps":[{"number":1,"description":"Given user login with user user and password Kasur1234!","duration":4202,"startTime":"2025-11-19T17:33:00.616345200+07:00[Asia/Jakarta]","result":"SUCCESS","precondition":false,"level":0,"children":[{"number":2,"description":"POST https://demoqa.com/Account/v1/GenerateToken","duration":1,"startTime":"2025-11-19T17:33:04.798065600+07:00[Asia/Jakarta]","result":"SUCCESS","restQuery":{"method":"POST","path":"https://demoqa.com/Account/v1/GenerateToken","content":"{\n    \"userName\": \"user\",\n    \"password\": \"Kasur1234!\"\n}","contentType":"application/json","requestHeaders":"Accept\u003dapplication/json, application/javascript, text/javascript, text/json\r\n\t\t\t\tContent-Type\u003dapplication/json","requestCookies":"","responseHeaders":"Server: nginx/1.17.10 (Ubuntu)\r\nDate: Wed, 19 Nov 2025 10:33:05 GMT\r\nContent-Type: application/json; charset\u003dutf-8\r\nContent-Length: 270\r\nConnection: keep-alive\r\nX-Powered-By: Express\r\nETag: W/\"10e-b7UJbVHHaxajx+UDod1BF16uOR8\"\r","responseCookies":"\r","responseBody":"{\n    \"token\": \"eyJhbGciOiJIUzI1NiIsInR5cCI6IkpXVCJ9.eyJ1c2VyTmFtZSI6InVzZXIiLCJwYXNzd29yZCI6Ikthc3VyMTIzNCEiLCJpYXQiOjE3NjM1NDgzODR9.GgqX_H1pjUO7xFKZE06BBC7rcQklVGRtEHqx_eFvZlw\",\n    \"expires\": \"2025-11-26T10:33:04.179Z\",\n    \"status\": \"Success\",\n    \"result\": \"User authorized successfully.\"\n}","statusCode":200},"precondition":false,"level":1}]},{"number":3,"description":"And user set userId with 821b4102-6bd2-45f0-bac3-e9671691f5ab","duration":1,"startTime":"2025-11-19T17:33:04.822116800+07:00[Asia/Jakarta]","result":"SUCCESS","precondition":false,"level":0},{"number":4,"description":"When user hit get books api","duration":586,"startTime":"2025-11-19T17:33:04.823169900+07:00[Asia/Jakarta]","result":"SUCCESS","precondition":false,"level":0,"children":[{"number":5,"description":"GET https://demoqa.com/BookStore/v1/Books","duration":0,"startTime":"2025-11-19T17:33:05.403229900+07:00[Asia/Jakarta]","result":"SUCCESS","restQuery":{"method":"GET","path":"https://demoqa.com/BookStore/v1/Books","content":"","contentType":"application/json","requestHeaders":"Accept\u003dapplication/json, application/javascript, text/javascript, text/json\r\n\t\t\t\tContent-Type\u003dapplication/json","requestCookies":"","responseHeaders":"Server: nginx/1.17.10 (Ubuntu)\r\nDate: Wed, 19 Nov 2025 10:33:05 GMT\r\nContent-Type: application/json; charset\u003dutf-8\r\nContent-Length: 4514\r\nConnection: keep-alive\r\nX-Powered-By: Express\r\nETag: W/\"11a2-8zfX++QwcgaCjSU6F8JP9fUd1tY\"\r","responseCookies":"\r","responseBody":"{\n    \"books\": [\n        {\n            \"isbn\": \"9781449325862\",\n            \"title\": \"Git Pocket Guide\",\n            \"subTitle\": \"A Working Introduction\",\n            \"author\": \"Richard E. Silverman\",\n            \"publish_date\": \"2020-06-04T08:48:39.000Z\",\n            \"publisher\": \"O\u0027Reilly Media\",\n            \"pages\": 234,\n            \"description\": \"This pocket guide is the perfect on-the-job companion to Git, the distributed version control system. It provides a compact, readable introduction to Git for new users, as well as a reference to common commands and procedures for those of you with Git exp\",\n            \"website\": \"http://chimera.labs.oreilly.com/books/1230000000561/index.html\"\n        },\n        {\n            \"isbn\": \"9781449331818\",\n            \"title\": \"Learning JavaScript Design Patterns\",\n            \"subTitle\": \"A JavaScript and jQuery Developer\u0027s Guide\",\n            \"author\": \"Addy Osmani\",\n            \"publish_date\": \"2020-06-04T09:11:40.000Z\",\n            \"publisher\": \"O\u0027Reilly Media\",\n            \"pages\": 254,\n            \"description\": \"With Learning JavaScript Design Patterns, you\u0027ll learn how to write beautiful, structured, and maintainable JavaScript by applying classical and modern design patterns to the language. If you want to keep your code efficient, more manageable, and up-to-da\",\n            \"website\": \"http://www.addyosmani.com/resources/essentialjsdesignpatterns/book/\"\n        },\n        {\n            \"isbn\": \"9781449337711\",\n            \"title\": \"Designing Evolvable Web APIs with ASP.NET\",\n            \"subTitle\": \"Harnessing the Power of the Web\",\n            \"author\": \"Glenn Block et al.\",\n            \"publish_date\": \"2020-06-04T09:12:43.000Z\",\n            \"publisher\": \"O\u0027Reilly Media\",\n            \"pages\": 238,\n            \"description\": \"Design and build Web APIs for a broad range of clients—including browsers and mobile devices—that can adapt to change over time. This practical, hands-on guide takes you through the theory and tools you need to build evolvable HTTP services with Microsoft\",\n            \"website\": \"http://chimera.labs.oreilly.com/books/1234000001708/index.html\"\n        },\n        {\n            \"isbn\": \"9781449365035\",\n            \"title\": \"Speaking JavaScript\",\n            \"subTitle\": \"An In-Depth Guide for Programmers\",\n            \"author\": \"Axel Rauschmayer\",\n            \"publish_date\": \"2014-02-01T00:00:00.000Z\",\n            \"publisher\": \"O\u0027Reilly Media\",\n            \"pages\": 460,\n            \"description\": \"Like it or not, JavaScript is everywhere these days-from browser to server to mobile-and now you, too, need to learn the language or dive deeper than you have. This concise book guides you into and through JavaScript, written by a veteran programmer who o\",\n            \"website\": \"http://speakingjs.com/\"\n        },\n        {\n            \"isbn\": \"9781491904244\",\n            \"title\": \"You Don\u0027t Know JS\",\n            \"subTitle\": \"ES6 \u0026 Beyond\",\n            \"author\": \"Kyle Simpson\",\n            \"publish_date\": \"2015-12-27T00:00:00.000Z\",\n            \"publisher\": \"O\u0027Reilly Media\",\n            \"pages\": 278,\n            \"description\": \"No matter how much experience you have with JavaScript, odds are you don’t fully understand the language. As part of the \\\\\\\"You Don’t Know JS\\\\\\\" series, this compact guide focuses on new features available in ECMAScript 6 (ES6), the latest version of the st\",\n            \"website\": \"https://github.com/getify/You-Dont-Know-JS/tree/master/es6%20\u0026%20beyond\"\n        },\n        {\n            \"isbn\": \"9781491950296\",\n            \"title\": \"Programming JavaScript Applications\",\n            \"subTitle\": \"Robust Web Architecture with Node, HTML5, and Modern JS Libraries\",\n            \"author\": \"Eric Elliott\",\n            \"publish_date\": \"2014-07-01T00:00:00.000Z\",\n            \"publisher\": \"O\u0027Reilly Media\",\n            \"pages\": 254,\n            \"description\": \"Take advantage of JavaScript\u0027s power to build robust web-scale or enterprise applications that are easy to extend and maintain. By applying the design patterns outlined in this practical book, experienced JavaScript developers will learn how to write flex\",\n            \"website\": \"http://chimera.labs.oreilly.com/books/1234000000262/index.html\"\n        },\n        {\n            \"isbn\": \"9781593275846\",\n            \"title\": \"Eloquent JavaScript, Second Edition\",\n            \"subTitle\": \"A Modern Introduction to Programming\",\n            \"author\": \"Marijn Haverbeke\",\n            \"publish_date\": \"2014-12-14T00:00:00.000Z\",\n            \"publisher\": \"No Starch Press\",\n            \"pages\": 472,\n            \"description\": \"JavaScript lies at the heart of almost every modern web application, from social apps to the newest browser-based games. Though simple for beginners to pick up and play with, JavaScript is a flexible, complex language that you can use to build full-scale \",\n            \"website\": \"http://eloquentjavascript.net/\"\n        },\n        {\n            \"isbn\": \"9781593277574\",\n            \"title\": \"Understanding ECMAScript 6\",\n            \"subTitle\": \"The Definitive Guide for JavaScript Developers\",\n            \"author\": \"Nicholas C. Zakas\",\n            \"publish_date\": \"2016-09-03T00:00:00.000Z\",\n            \"publisher\": \"No Starch Press\",\n            \"pages\": 352,\n            \"description\": \"ECMAScript 6 represents the biggest update to the core of JavaScript in the history of the language. In Understanding ECMAScript 6, expert developer Nicholas C. Zakas provides a complete guide to the object types, syntax, and other exciting changes that E\",\n            \"website\": \"https://leanpub.com/understandinges6/read\"\n        }\n    ]\n}","statusCode":200},"precondition":false,"level":1}]},{"number":6,"description":"Then user can verify all of these books\r\n| isbn | title | subTitle | author | publish_date | publisher | pages | website | description |\r\n| 9781449325862 | Git Pocket Guide | A Working Introduction | Richard E. Silverman | 2020-06-04T08:48:39.000Z | O\u0027Reilly Media | 234 | http://chimera.labs.oreilly.com/books/1230000000561/index.html | This pocket guide is the perfect on-the-job companion to Git, the distributed version control system. It provides a compact, readable introduction to Git for new users, as well as a reference to common commands and procedures for those of you with Git exp |\r\n| 9781449331818 | Learning JavaScript Design Patterns | A JavaScript and jQuery Developer\u0027s Guide | Addy Osmani | 2020-06-04T09:11:40.000Z | O\u0027Reilly Media | 254 | http://www.addyosmani.com/resources/essentialjsdesignpatterns/book/ | With Learning JavaScript Design Patterns, you\u0027ll learn how to write beautiful, structured, and maintainable JavaScript by applying classical and modern design patterns to the language. If you want to keep your code efficient, more manageable, and up-to-da |\r\n| 9781449337711 | Designing Evolvable Web APIs with ASP.NET | Harnessing the Power of the Web | Glenn Block et al. | 2020-06-04T09:12:43.000Z | O\u0027Reilly Media | 238 | http://chimera.labs.oreilly.com/books/1234000001708/index.html | Design and build Web APIs for a broad range of clients—including browsers and mobile devices—that can adapt to change over time. This practical, hands-on guide takes you through the theory and tools you need to build evolvable HTTP services with Microsoft |\r\n| 9781449365035 | Speaking JavaScript | An In-Depth Guide for Programmers | Axel Rauschmayer | 2014-02-01T00:00:00.000Z | O\u0027Reilly Media | 460 | http://speakingjs.com/ | Like it or not, JavaScript is everywhere these days-from browser to server to mobile-and now you, too, need to learn the language or dive deeper than you have. This concise book guides you into and through JavaScript, written by a veteran programmer who o |\r\n| 9781491904244 | You Don\u0027t Know JS | ES6 \u0026 Beyond | Kyle Simpson | 2015-12-27T00:00:00.000Z | O\u0027Reilly Media | 278 | https://github.com/getify/You-Dont-Know-JS/tree/master/es6%20\u0026%20beyond | No matter how much experience you have with JavaScript, odds are you don’t fully understand the language. As part of the \\\"You Don’t Know JS\\\" series, this compact guide focuses on new features available in ECMAScript 6 (ES6), the latest version of the st |\r\n| 9781491950296 | Programming JavaScript Applications | Robust Web Architecture with Node, HTML5, and Modern JS Libraries | Eric Elliott | 2014-07-01T00:00:00.000Z | O\u0027Reilly Media | 254 | http://chimera.labs.oreilly.com/books/1234000000262/index.html | Take advantage of JavaScript\u0027s power to build robust web-scale or enterprise applications that are easy to extend and maintain. By applying the design patterns outlined in this practical book, experienced JavaScript developers will learn how to write flex |\r\n| 9781593275846 | Eloquent JavaScript, Second Edition | A Modern Introduction to Programming | Marijn Haverbeke | 2014-12-14T00:00:00.000Z | No Starch Press | 472 | http://eloquentjavascript.net/ | JavaScript lies at the heart of almost every modern web application, from social apps to the newest browser-based games. Though simple for beginners to pick up and play with, JavaScript is a flexible, complex language that you can use to build full-scale |\r\n| 9781593277574 | Understanding ECMAScript 6 | The Definitive Guide for JavaScript Developers | Nicholas C. Zakas | 2016-09-03T00:00:00.000Z | No Starch Press | 352 | https://leanpub.com/understandinges6/read | ECMAScript 6 represents the biggest update to the core of JavaScript in the history of the language. In Understanding ECMAScript 6, expert developer Nicholas C. Zakas provides a complete guide to the object types, syntax, and other exciting changes that E |","duration":9,"startTime":"2025-11-19T17:33:05.409475700+07:00[Asia/Jakarta]","result":"SUCCESS","precondition":false,"level":0}],"userStory":{"id":"api/bookStorePageApi","storyName":"Book Store Page API","displayName":"Book Store Page API","path":"api/bookStorePageApi","pathElements":[{"name":"api","description":""},{"name":"bookStorePageApi","description":""}],"type":"feature"},"title":"Verify Get All Books","description":"","backgroundTitle":"","backgroundDescription":"","tags":[{"name":"bookstore-api","type":"tag","displayName":"bookstore-api","rawStringFromValueTag":"bookstore-api"},{"name":"regression","type":"tag","displayName":"regression","rawStringFromValueTag":"regression"}],"startTime":"2025-11-19T17:33:00.604771700+07:00[Asia/Jakarta]","endTime":"2025-11-19T17:33:05.419224300+07:00[Asia/Jakarta]","duration":4193,"projectKey":"","isManualTestingUpToDate":false,"manual":false,"testSource":"Cucumber","order":0,"result":"SUCCESS"}